{"schema_version":"1.0.0","case_id":"case-demo-20260927","candidate_link_id":"link-demo-001","left_entity_ref":"address:bcrt1qdemosynthetic001","right_entity_ref":"address:bcrt1qdemosynthetic002","proposition":"possible_common_control","supporting_refs":[{"evidence_id":"ev-demo-transactions","source_sha256":"0000000000000000000000000000000000000000000000000000000000000000","locator_type":"synthetic","locator":"transaction:1","byte_start":null,"byte_end":null}],"opposing_refs":[],"method_version":"example-only-1","uncertainty":0.8,"review_status":"unreviewed"}
